id,question,answer
1,"What is e-waste?","E-waste refers to electronic waste including discarded devices. It encompasses everything from smartphones and laptops to printers and gaming consoles that have reached end-of-life."
2,"Why is e-waste recycling important?","E-waste recycling is crucial because electronic devices contain harmful materials like lead and mercury that can damage the environment. Proper recycling also recovers valuable materials like gold and copper, reducing the need for mining."
3,"What electronic items do you accept?","We accept most electronic devices including: computers, laptops, smartphones, tablets, printers, monitors, keyboards, mice, cables, gaming consoles, DVD players, and electronic accessories."
4,"How do you handle data security?","We follow a strict data security protocol: 1. Professional data wiping using DoD standards 2. Physical destruction of storage devices if requested 3. Certificate of destruction provided 4. Fully documented chain of custody"
5,"What are your pickup services?","We offer free pickup for businesses and residential customers. Schedule online or call us. Available Monday-Saturday, 9 AM - 6 PM. Bulk pickups welcome!"
6,"Is there a cost for recycling?","Basic recycling is FREE! Special services have minimal fees: Data destruction certificate ($10), Express pickup ($25), Bulk commercial pickup (custom quote)"
7,"How do I prepare items for pickup?","1. Remove any personal items 2. Gather all cables/accessories 3. Back up important data 4. Place items in a safe, dry location 5. Make sure path is clear for pickup team"
8,"What happens to my e-waste?","Your e-waste goes through our certified process: 1. Sorting and evaluation 2. Data destruction 3. Dismantling 4. Material separation 5. Recycling of components 6. Proper disposal of hazardous materials"
9,"Are you certified?","Yes! We hold: 1. R2 Certification 2. e-Stewards Certification 3. ISO 14001 Environmental Management 4. NAID AAA Certification for data destruction"
10,"How do you protect the environment?","We follow zero-landfill policy. 100% of materials are either recycled or properly disposed. We use eco-friendly processes and partner with certified downstream recyclers."
11,"What about batteries?","We accept all types of batteries: Lithium-ion, NiMH, NiCD, Lead Acid. Special handling procedures ensure safe recycling and environmental protection."
12,"Do you offer corporate services?","Yes! We provide: 1. Bulk pickups 2. Regular collection schedules 3. Asset tracking 4. Custom reporting 5. Certificate of recycling 6. Employee collection events"
13,"What areas do you cover?","We service all major metropolitan areas with door-to-door pickup. For remote locations, we offer mail-in recycling programs."
14,"How do I track my pickup request?","Track your pickup online using your request ID. You'll receive email updates and can check status 24/7 through our portal."
15,"What's your impact?","Last year we: 1. Recycled 1M+ devices 2. Saved 1M gallons of water 3. Prevented 100K lbs of e-waste from landfills 4. Recovered 10K lbs of precious metals"
16,"Do you accept damaged electronics?","Yes! We accept broken or non-functional devices, including water-damaged, cracked, or missing parts. Our recycling process safely handles all conditions."
17,"Can I drop off my e-waste instead of pickup?","Absolutely. You can drop off items at our certified recycling centers during business hours. Please check our website for the nearest location."
18,"How long does the recycling process take?","Most items are processed within 5–7 business days. Large commercial loads may take up to 10 days."
19,"Do you refurbish any devices?","Yes, whenever possible, we refurbish working devices to extend their life and donate them to schools, charities, and community programs."
20,"What happens to refurbished items?","Refurbished items are tested, cleaned, and restored to working condition before being donated or sold at low cost to reduce e-waste."
21,"Do you accept home appliances?","Small electronics like microwaves, toasters, and coffee makers are accepted. Large appliances like refrigerators and washing machines may require special handling."
22,"Do you provide recycling bins for offices?","Yes! We offer dedicated e-waste collection bins for offices with regular pickup schedules."
23,"What happens to cables and chargers?","Cables and chargers are stripped for copper, aluminum, and plastic, which are then recycled into raw materials."
24,"Can I recycle light bulbs?","We accept certain types of bulbs, including CFLs and LEDs, with safe mercury handling procedures."
25,"Do you buy old electronics?","In select cases, we offer trade-in value or cash for high-demand working electronics."
26,"How do you recycle circuit boards?","Circuit boards are sent to specialized facilities to extract precious metals like gold, silver, and palladium."
27,"Do you accept electronic toys?","Yes, we accept battery-operated toys, learning devices, and gaming accessories."
28,"Can I get a tax deduction for recycling?","Yes! We provide donation receipts for refurbished items donated to charitable organizations."
29,"Do you recycle ink and toner cartridges?","We accept ink and toner cartridges for specialized recycling that prevents toxic waste."
30,"How can businesses ensure legal compliance?","We provide full documentation, certificates, and reporting to meet all e-waste regulatory requirements."
31,"Do you recycle solar panels?","Yes, we process end-of-life solar panels to recover glass, silicon, and metals."
32,"What about wearable devices?","We recycle smartwatches, fitness trackers, and wearable medical devices following the same data security standards."
33,"Do you accept hospital equipment?","We accept most non-hazardous electronic medical devices after proper decontamination."
34,"Can you recycle drones?","Yes, drones are dismantled for battery recycling, motor reuse, and safe disposal of electronic parts."
35,"How do you recycle TVs?","We remove hazardous materials like leaded glass from CRTs and recover valuable components from flat-screen TVs."
36,"Do you offer community recycling events?","Yes! We host public collection drives for households and schools to drop off e-waste safely."
37,"What should I do with my old SIM cards?","We recommend shredding SIM cards or allowing us to destroy them as part of our secure recycling process."
38,"Do you recycle cryptocurrency mining equipment?","Yes, we recycle mining rigs, GPUs, and servers to recover valuable metals."
39,"Do you handle hazardous e-waste?","Yes, we follow strict environmental and safety protocols for items containing mercury, lead, and cadmium."
40,"Can I track the environmental impact of my recycling?","Yes, we provide impact reports showing resources saved and waste diverted from landfills."
41,"Do you accept floppy disks and CDs?","Yes, we shred and recycle storage media, ensuring complete data destruction."
42,"Can I recycle 3D printers?","Yes, we dismantle 3D printers and recycle motors, electronics, and metal components."
43,"Do you recycle electric vehicle batteries?","Yes, EV batteries are processed at specialized facilities for safe material recovery."
44,"Do you work with schools?","Yes, we offer e-waste education programs, collection drives, and recycling services for schools."
45,"What’s the safest way to dispose of a phone battery?","Keep it in a cool, dry place and bring it to our facility for safe recycling — never throw it in the trash."
46,"Do you recycle power banks?","Yes, we accept and safely process lithium-ion power banks."
